<?xml version="1.0" encoding="UTF-8"?>
<pollcreators xmlns="http://wsd.com/assignment2" 
	xmlns:xsi="http://www.w3.org/2001/XMLSchema-instance"
	xsi:schemaLocation="http://wsd.com/assignment2 users.xsd">
	
	<creator id="0">
		<username>John</username>
		<password>12345678</password>
	</creator>
	<creator id="1">
		<username>Brodie</username>
		<password>hello123</password>
	</creator>
	<creator id="2">
		<username>Zoe</username>
		<password>d0gsArecoo1</password>
	</creator>
	<creator id="3">
		<username>Tiarne</username>
		<password>CakesAreTasty</password>
	</creator>
</pollcreators>
